speaker_tag	text	sentiment_score
1	It's it's an incredible challenge to have the infrastructure ready to go for that amount of people in this kind of remote area, even though it's used every year for the national. It's every year the national Jamboree happens at that location. It's been that way for years and years and years, but the having the world one there has happened before it's gone on there before he was A little maybe like eight or nine years ago that it happened is a big deal that's happening there again this year, but the Pioneer Scouts are boys and girls if you look at the posters in the game, it shows boys and girls so it seems like inclusivity is a big thing with them. Another thing that I thought was funny that people were reacting to was their values and how you dimmick are going to demonstrate kindness helpfulness of bravery and and growth in Fallout 76 because generally whenever they have like those whenever you have some sort of Ideal that you're trying to represent it's generally a pretty warped definition of what that is. So I'm curious how that we're going to do some kindness helpfulness bravery and growth. I'm excited for badges. I'm curious how this will work other than vending machines because I would want to like put them put them on my backpack. Yeah. You know what? Is one of the things that they're adding with this they're giving us backpacks. You can read more about that, which is something that is pretty cool makes sense for this game. One of the things you can add in like technology quote unquote. It's not like you're some sort of like cyber hacker in you're going to hack a doodle doo into your back doodle dude your it's I think it's mostly extra storage extra armor or a refrigerator you can like Small refrigerator you can put there. So the items can keep longer there.	
3	You have a look at that.	
1	I'm curious of this Camp items are curious how you're gonna display your badges because like I want to walk around with my badges. That was the whole thing. Yo your it. Did you did Boy Scouts briefly briefly.	
3	I was wasn't my scene man.	
1	I see I didn't I was never an eagle scout I went from I think I you start as a tiger then you go to a wolf Then you go to there's there's a there's a third one and then you hit up. We blow made all the way we blow nerd.	
3	I'm just kidding. Well, I'm just kidding. That's just a joke.	
1	These are just some jokey jokes man, you know, well, you know, at least at least I didn't work behind the counter at Food City, so I didn't work behind the counter Food City.	
3	So who's the joke on now now you talk about old Nick Thompson.	
1	Oh, that's true because you were busy stocking the shelves. I didn't do that either. You're over to dog. What are you? What did you do?	
3	What I had the prestigious opportunity of being a bag boy in high school. So sorry.	
1	I don't want to hear only had to go get this carts in the winter their buggies. Oh, oh, excuse me, uh Embrace debate. I do. I do Embrace that debate, huh? So I'm excited for what this is. Oh and the event so there was a data mine the kind of a little Of this event and it seems like that. There's there's this narrative that they put up but it seems like the disadvantage is going to be special in a way that it's not just like hey go kill this thing. Yeah, it's gonna be a little more abstract. It seems like it seems like that. There's a little bit like from the data. Mine is it led us to believe that there's a little bit of like a choose-your-own-adventure kind of thing of like, how do you want the story to go? Go will monster come will it like some of those elements within it? So I'm excited about that. There's a lot of stuff to be excited for especially I think it's in May they've got backpacks have got the Pioneer Scouts come in. They've got your legendary vendors all your legendary items are getting changed over. They've got the new dungeon arctos Pharmacy. That's gonna be good time.	
3	I've got a picture of all the backpacks here are the viewers.	
1	Yeah, let me show them real quick. Look at this. See all this. Wow. Wow driving your cars. You thinking about the backpacks in your head. You haven't looked at it go. Look at the latest inside the Vault check these out. A lot of people are talking about some of the different faction themed ones the more Wasteland themed ones and then the baby Mothman is a favorite but I like the sloth one where you have like, it's like a little baby stuff sloth attached to your back. It's like it Disney World. Where you have all the kids walking around that have the dinosaur backpacks that have the leash attached to them and that's what I wanted to be is is akin to one of those rights like a little baby sloth walk around with me. Let's see what else do I have? So this week was actually probably the conclusion for Sheepsquatch and the game finally the Sheepsquatch revealed himself. To the masses through an event called free range in which you got a shepherd's Crook and you had to herd cows from one portion of the map to the other while defending it from different monsters inning in a Sheepsquatch as well as Random Encounters with the Sheepsquatch the Sheepsquatch. I have played both of those of course, and there's some crafting items that you get like you can craft your shepherd's crook with like Barbed. Wire or different stuff you can get a Sheepsquatch club that has a Sheepsquatch like skull on it or you can make these like throwing knives Tomahawk things that are from quills of the Sheepsquatch. But as far as introducing a Cryptid like taking it from the beginning of April to now and they'll all the quests and all the things they've done every week. It's really been a fantastic job where they have started with. This main quest of lying low of going through and in understanding that and getting the the I guess the meat of that understanding that storyline and then leaving it up to say well the Sheepsquatch us out there and putting it in the game as at some locations. You can hear something in the woods like you can hear the Sheepsquatch go off. It's like it's like and whenever the three ranges on the map, they don't give you a notification. In the game, you can hear it. If you're not listening to radio anything, you can hear the Sheepsquatch call and that lets you know that the event is happening and it's not that loud. It's like you have to be you have to be out in the forest. You have to be like somewhere quiet you can hear like it. So I think that's pretty cool. I want them to I want them to continue with this. This is cool. This is what I wanted them to do is continually like Like I did in this content people love Cryptids. That's we love Cryptid so much that's now 30% of our show. We really talked about crimson's today. It's going to be 60% spoiler alert. But if you read the title this you probably already know.	
3	I'm excited speaking of Cryptids real quick. Did you see today that some people on I think in the Himalayas may be found some very suspicious footprints that look like what they believed to be a Yeti.	
1	I did not it was in like the news new you sharing this outside of the cryptic Club corner. I'll have you know, you you have you have gone you have gone beyond we're talking Cryptids the whole episode.	
3	It's okay.	
1	This is the one episode the one episode where it's fine.	
3	We've already started so they saw the Prince Henry like whatever Army is stationed where they found them was out just doing a run I think and found these footprints that they said were not of any animal that they know that is native. to that area like giant like man like man animal like Footprints so Was it the Sheep squash was that the Sasquatch what what level of Squatch was a Squatch in them Woods demo, it would be the snow so well in them Hills the mountains right? It's used to mountains. Yeah, so I don't know it was on the news today though.	
1	I definitely saw it on I think it would be a cool environment have in fall is like a snowy environment. I wish they would do seasonal like in the winter.	
3	You get some snow in the forest by wish parts like I wish It had like half of the Savage divide was snow kind of like Red Dead you go up north right gets.	
1	Yeah, that would be cool. I would be down for that. I'm with it maybe in the nuclear winter.	
3	I see the vision season.	
1	They have I see the vision for a winter winter winter is here, but on the last note the patch 9 which includes ever upwards which includes backpacks which includes whatever they feel like putting in hopefully. Player vending, that'll come I think in this update that's what they have it scheduled for. I don't know they like change their mind about when they're doing that will be coming all on May the 7th, May the 7th. So so close its first met it was 102 degrees when I ran into my car today because yeah, but that's just your in the sun.	
3	It's probably the 80s though.	
1	I said, it wasn't a 90s. I'd looked at the weather so nice at the airport sheesh. Yeah GE GE airport as we call in the I'm Wade airport. I hate summer GE GE not ready for summer.	
3	I hate summer so much summer. Here's terrible. I need the mountains back.	
1	We do. We let's just go move up. We'll just let's make camps will go up there living cabins. You don't seem that enthused about it.	
3	I'm actually very enthused about that. Just dreaming about how wonderful that would be.	
1	All right, well with that we'll move on to our next segment.	
2	Welcome back dear listeners. It's time once again to put aside all you think, you know all you believe to be true time to open your mind to the strange bizarre and sometimes terrifying world that exists in the shadows and fringes of our own where myth Legend and roma Are Made Real. Yes. It's time for more thrilling Tales from the West.	
1	What are you pumped for bummed about this? What are you pumped for? This is this whole section this whole section. Will this can this can be the time when we're talking about this? I like that intro. Let's do it. Okay, it's already gone already here. We're going we're here. We're here hot mic we're talking about it. What are we talking about?	
3	We are talking. About wendigos wendigos.	
1	Our old our old pals are our wendigos our friends from the hills that are not pronounced when dingoes when Dango HL baby oven Dango wendigo a windigo, which I had somebody write in I think it tweeted us way back way back. Let's do a rewind And that was the day I I'm I'm very well aware what the rewind was? Okay. I'm up to date with the time Trapper. There's so much time travel going on. I don't know what's happened.	
3	We bring it back up. Now.	
1	I'm not bringing it back up.	
3	But that was as coming back to looking back to present. Okay, we're back to president.	
1	We're talking about wendigos. Now. If you don't know what it windigo is there in Fallout 76 imagine that this is the final Cryptid we've yet to talk about this in the game. We've done episodes on flight. Monster grabbed a monster Moth Man Sally gasping.	
3	I'm trying to think of the other Cryptids that are done quite a few but the windigo has eluded us the windigo has long eluded us.	
1	It's and Julie are we talk about the wind to go on really the first true day of summer? Yes or is so hot. We're here. We're here. We're right here.	
3	We're talking about it.	
1	It's happening to so as the tail goes. The windigo was a lost Hunter during a brutally cold winter his intense hunger drove him to cannibalism after feasting on human flesh. He became a crazed monster roaming the forest in search of more people to eat. It's not a good look. It's not a good look. So that's the the simplified. Yes.	
3	I suppose version of feel like it's just a its. What do you think about it? He really the windigo really is like the creepiest to me. Like it's very disturbing.	
1	It serves a think it serves the cultural purpose. Yeah as well. I mean it's very rooted in like old folklore from what goes back to on Algonquin lure of and now the on Quints were primarily in Canada in that area, right? They were oh my gosh. I will well transparency the transparency. We do a lot of editing. We're not perfect. We do a lot of editing This is highly edited. We the Algonquin so I don't know what I've talked about. We like I'm an Algonquin are primarily in Canada and they essentially created this, you know, and I can't get into the head of what the Algonquin were thinking but with most myths and and stories and stuff there, too. I guess generate a law or have some sort of moral lesson to teach the windigo is primarily a story told in Algonquin tribes about this spirit that possesses you to eat human flesh. And once you start eating human flesh, you can't stop just pop fun. Don't stop right and it only happens when you're cold and greedy. So essentially it was saying hey when you go out to hunt and it gets really cold in the winter you Eat other people. Yeah, don't do that or else your turn into a windigo.	
3	Well, that's one way to keep people from doing it.	
1	Right. You don't want to be a win to go. Nobody wants to be windigo like being it being the loser, but I don't know because then when it goes back then were described as like SuperDuper lanky and larger larger than a normal human. Yeah and very gray pale skin with bunny teeth and antlers. Yeah, which are not present in and fought 76 is	
3	Right version of the windigo she different versions. But yeah, so it was basically a way to deter people from from being cannibals essentially, right? It's kind of like how my mom used to tell me if you keep doing that with your face. It's going to get stuck that way. Yeah, it's just Algonquin version of that right a little more brutal.	
1	If you don't eat your vegetables, how you going to grow hair and chest if you sit too close to the TV your eye your vision is going to be bad, right?	
3	There's other ones, but I won't So yeah, so there's a lot of I'm actually glad you said that because I was about to say it but you know, there's there's a lot of those but yeah, so it's sort of just like this cautionary tale that would keep children up at night, right? Yeah. I mean, it's a good method when you think about it cuz I mean even now I'm a little scared.	
1	Yeah, there's two different there's two different theories of thought with windigos of where they draw their power because they're very fast. Every incarnation of wendigos are very fast, right? They have a lot of strength as well.	
3	But that's my question is where we're like, where's that strength coming from because their arms are like the size of my pinky, right?	
1	And and and that's theory of where they draw their Our so ancient lore would say this Algonquin Lord would say that it would be a demon that would possess them to eat the flesh when they are feeling greasy mess with demons reading cult. And so then the spirit of the the windigo would be inside you you would become a wendigo at that point. The other theory is that when you ingest and a lot of human flesh. Yes that you gain Supernatural. Power and then become like because you have ingested in the forbid The Forbidden meat. Yeah, you you gain these powers to become a wendigo. So it's not by a spirit. It's by the supernatural nutritional value of human flesh. Well old are many calories were talking. Yeah. Wonder what I wonder what the caloric intake sodium.	
3	I need to know like the nutrition right the nutritional values this	
1	Organic grass-fed. Yeah, well if there's they then you know, we got to hear both sides of the story. We do so not condoning cannibalism. Let me just say that no no and we've talked about cannibalism on this podcast before has just actually we've done this before. In fact, we've done it all with drugs and alcohol involved as well. Yes, and it's all been wrapped up into one and two into my character and fall outside. 86 but I think that you were the origins of the windigo are interesting, but I think what's more interesting is its pervasiveness in pop culture, which was something that I was particularly. Interested in reading and seeing you had stories of hunters from the 1800's that were out and doing stuff and hunting and went to put cold Lodge and then the the windigo is there like all surprise surprise, but I think modern and can't like incarnations of it are interesting. So for example, Stephen King has had a big influence on what I guess. A modern version of a wendi-go is he wrote particularly two books that are their famous one that I don't know much about which is called The Girl Who Loved Tom Gordon, which was about a wind this girl who is hunted while she's on the Appalachian Trail in Maine or Massachusetts or Appalachian Trail is not Massachusetts. Probably in lower Maine Vermont. I don't know one of the state's she's somewhere she is. Blind, but she's on the Appalachian Trail and a win to goes hunting her which is the inspiration. If you look for the artwork that is like the tales of the West Virginia heels artwork where they have the windigo episode you'd see the face of the wind to go and fall at 76 but in his eye you can see a boy that is almost a direct copy of the girl from the cover of that book.	
3	Fun fact timely. Fun fact about the Appalachian Trail the trailhead Ours are in Harpers Ferry.	
1	Let's chew some would call that the midpoint of that blood trail. So it started in that and then in Pet Cemetery, which is had two movies now is very famous book. All of this happenings are from a spiritual windigo that possesses. Not only these things to come back to life of spoiler alert animals come back to life and spoiler alert it. It it makes everybody get real angry and greedy and want to like it influences them to behave erratically. So truck drivers that drive through there, which is like a I guess off the beaten truck truck passage and in both the books in the movie Speed heavily through there and that causes some some frightening things for the family of and I do that here in the neighborhood of when I see people passing by I'm Shake your fist. Yes, I in my head a man thought about getting a clothesline out and then you know as as the motorcyclist at 2:00 a.m. Come screeching to the neighborhood. They are they wake me up every time.	
3	Yeah, I've heard him to they go down my road like crazy. But so if I'm I've never seen or read pet cemetery, but from what I understand, it's Basically, these people are brought back to life. Right but they're not them. They're not themselves.	
1	No, they're not themselves are very like with the word mole of Mel violent.	
3	there's a dog fight going on upstairs very just like aggressive and evil and	
1	just kind of just very off right there there tinged more towards the evil spectrum.	
3	That is we think of when I was in school. I remember we read like a short story like the monkey paw a monkey's paw or something like that. It sounds familiar. It was basically the the family something along the lines of they were granted A Wish by this monkey's paw and their son I believe had died. In the war and they wish that he would come back but they but they were told that he would not be the same and that he would be you know bad and it wouldn't be their son and all this stuff right? I think that I think the story ends with they did wish for it and then they just hear this like clawing on the front door like it right after it and then that it's over that kind of makes me think of that like a yeah.	
1	Yeah, the the spiritualness of it has been I guess covered in in a bunch of different Realms like the game until dawn if you haven't played that you should it's probably one of the best like not necessarily point-and-click. It's like a Choose Your Own Adventure Style game with Hayden Panettiere and the guy from Mr. Robot and the queen movie. I forgot Rami. Oh, you're talking about yeah the plays he's got real big big eyes. Yeah big guy. I got creepy. Yeah, man, he's in it. This is a got like this like weird star-studded cast Hayden Panettiere. So yeah from heroes in the show Nashville, you know, she was still doing it. Yeah. She was in the video game. It's really good. It is a perfect. Like teens go to a cabin in the winter and Mischief occurs, and there's twists and turns but a portion of that game is the legend of wendigos. And in that one. It's more of a spiritual element to it. You should go play that game. I don't want to spoil too much about that game because half of that game is story. Yeah, don't give it away. I don't want to give it away. But that's another representation of spiritual when it gets tough. The thing that I think is more interesting. Interesting is the belief that consuming human flesh gives you Supernatural Powers Yeah.	
3	It's like they on one end. They tell you that you'll turn into this horrific creature, but then on the other end there like you'll turn into this creature because eating human flesh gives you super powers. So it's like, you know, there's some people out there that are like like way in the office super powers, like maybe they shouldn't include that that your I get super powers, right and that be like know you'll turn into this horrific being that's all you need to say.	
1	So there's a line that's drawn there between skinwalkers. Yes.	
3	And when that goes are you familiar skin wives like vaguely like I've definitely heard of them and of that folklore, but right could probably both of these these being yeah that	
1	Infiltrate that look like your friends that stalk groups that paranoid people that change their face to look like this or that and then plot the demise of these essentially Slenderman are they associated with like fairies and like Irish or maybe Scottish cultures? I think so, I think you're right. I think you're right.	
3	They thought that they weren't really the person that they were portraying essentially and I think a lot of people were Like executed because of that because they thought that they really weren't. Yeah, there was there was a story I read about that and a lot of times if people would not act like themselves and maybe they'd have a really bad fever and be really sick, right it was as if you know, they were there they were infiltrated and it was like a demon demonic thing and I think I'm wanting to say maybe it was Irish either Ireland or Scotland one of the two it was really big thing back way back. Back in the day that they thought people were basically had been possessed. Right?	
1	So it's kind of yeah, they it seems like in folklore they seem to look similar under scribes similarly, but but they can tell the difference is at the human flesh. Yeah, the the consumption of human flesh. So Wendigos the horns of a wendigo. So typically it's portrayed and has been portrayed in folklore as having a skull ish face with akin to deer antlers on their head. And and so one thing I didn't realize one of my favorite shows on NBC the probably there will never be another show like that. NBC will never allow another show like this on there called Hannibal. Have you heard of Hannibal watched Hannibal? Anibal is the story of Will Graham who is a crime-scene expert who gains I guess knowledge about crime scenes via being extremely empathic and so can really get into the mind of the murderer gets together with the lead FBI agent. Who is a forgot	
3	I had his name.	
1	He's Morpheus in The Matrix. Very famous.	
3	Actor. Oh Lawrence Lawrence Fishburne.	
