speaker_tag	text	sentiment_score
3	Hey everybody. This is how you are. I just want to talk to you a little bit today about some happen to me the other day and they've asked me if I tell you about it just because it kind of changed my life. I think it'll change your life. It changed his life changed my aunts life changed everybody's life. So I was down at My Cousin Skeeter shop. But today I walked in there and I was trying to steal couple parts because my Ford ain't working right and Skeeter walk in he didn't know I was doing two skaters kind of stupid and he was like, hey bud. I got something I need to tell you want to take a seat right there. Tie a seat right there. He said I want to tell you about something that I found out they if you haven't heard about it. I think it's wrapped right time. You did. He says it's called anchor and it's the easiest way imaginable to make podcast and I was like, well, that's like Skeeter. All right. Well, I'm you got my you have my curiosity got my attention. But so he said well, let me talk to you about it. He said it's free. There's creation tools on it. They allow you to record. Edit your podcast right from your phone or your computer and it will distribute your podcast for you. So it can be heard on Spotify on a podcast many other things many more many more platforms. You can make money from podcast no minimum listenership. It's everything you need to make podcast in one place. And I started thinking about it and I ain't never heard Skeeter say none of these words before so obviously it took to him pretty well.	
1	It must be pretty important to him.	
3	So I just want to come on here and tell you that you should download anchor today and you know, just just do with it what you want to do man. Just just have a good time with it. My cousin skaters making a podcast now and he just is just having time with life with it. And you know, I keep stealing his Parts but he's making money from anchor and it kind of offsets it all so he can keep Even and he can feed his kids and family and all that stuff right there. So it's a download anchor Today and and maybe maybe you can be you know the next Skeeter. I don't know.	
2	Following total Atomic Annihilation the rebuilding of this great nation of ours may fall to you. That's why we here at fault boys. WB will take you on an orator of the beautiful state of West Virginia. There's no other place to be better prepared for the impending fall out. Now we go live to our team of experts.	
1	Hello and welcome to Vault boys WV a mutated podcast crossbreeding our shared history and Appalachia post-apocalyptic State and fall. 76 I'm Your Country Road scholar Dave chaffins and joining me is my favorite son of a moth man. Austin O'Connor. How you doing, Austin?	
3	What's up? What's going on man?	
1	Nothing much. We went on our mandate this past week that we did we did that we did solve interest in game. No spoilers. We're not going to spoil anything. I don't want to I would only want to talk about it just because I don't even really get into like Game of Thrones either because we had a whole tangent last time. I'm and I know right before this podcast we talked for about 25 minutes about Game of Thrones. So I've got her I've gotten you I've gotten that out of your out of your system good. Oh, that's good. It's a good talk Boba Fett kills Commander Shepard.	
3	I yelped Yelps like five times during the episode like horribly. My living room alone yelped.	
1	What what restaurants were you reviewing?	
3	Hi. I howled I hollered I screamed you wolf. Yeah, I whooped whoopty whoop.	
1	Well, we had a nice little nice little mandate the only problem until you like sprained your ankle. Yeah, I got up so we sat on the front row the movie theater with well, it's not really the front row second T, right. It was like right at the front of the walkway. So we had like bar so we could like put her feet up on and it was nice because we can leave we can leave as we pleased. Yeah. Well you you had to go pee I dehydrated you. Can you stop? Drinking water at work. Yeah. Yes. I made sure that I did not have to pee the whole movie and I got I think I got a so did I guess soda I think so de popcorn. I think twice twice during the movie. But the first time I got up depth perception didn't work and so the floor where it wasn't where I thought it was and so it's like it's during a scene I get up I go over the corner and I just land on my ankle fun.	
3	And then I'm in front of the theater like living and living in my own shame and then I walk I'm I'm slowly limping because it all I saw was like out of the corner of my eye your silhouette just drop really quickly and I look and I just See Your Shadow just hobbling slowly but like with and I could see your face for a split second. You were like, okay, just keep going.	
1	Well. I know how to get out of the vision of these. People who like booking it, but in the most painful way possible because these people are here to enjoy this movie and we had the person from the theater which I've never seen I've been to be I was weird plenty of times and this guy comes in and gives us the speech. That's essentially everyone if I see you using your cell phone from in the booth. I'm going to come down here and take it away or throw you out and make sure to respect your neighbor and don't talk about spoilers if you if you see if you've seen the movie. I've seen this movie three times and it's the greatest film I've ever seen.	
3	Yeah, it was like if if I see I'm gonna have to bring you out. We're have to look at every photo and your phone and make sure you didn't take any video jokes on him, right? All I have is 33 thousand pictures of Jason Alexander in my phone. So he would have been really upset but our is that for the memes? Yeah, because he looks like Jon Snow Jon Snow looks like him I've seen that mean if you like.	
1	I'm up to date on my Mimi's.	
3	Your movies, but listen, I want to talk about something real quick that happen to me over the weekend. Okay, so as you know, and as everybody else knows I had fun encounters with Spirits with the supernatural okay in my time. So, okay. I went to one of my one of my really good friends weddings in Virginia and I was the photographer for the wedding, right and we it was up. We stayed in the Eastern panhandle of West Virginia. So I was up around Harpers Ferry, but the wedding was near win.	
1	Esther right Winchester, if you want to know more about Harpers Ferry, you can listen to our last steps.	
3	Yes exactly. What was that work? Exactly? Exactly. Exactly. Yeah, Sean Connery down here. I drove up on Friday the morning after we saw Ventures and we it was me and two of my friends they were both in the wedding and we had no idea where we were going and I've never been to Winchester, Virginia. I've been near it because I whenever I go to DC.	
1	I cut off 81 cut up just before Winchester, but right and you take that that like passageway that there's not any traffic on and you avoid all that Richmond. Oh, yeah situations.	
3	So I-95 we text the bride and say Hey Taylor. What's the address? We don't know where we're going. So she sends the address first. We took the wrong road because it told us to go left and we were like this is definitely not it so then we come down and we're like, well, this is the only other thing that makes sense, but it was this big Huge mansion and it was gated like there was a gate out front and you go up and there is like a covered little Dome with the pillars around it. I don't know what you would call it like a gazebo kind of like a gazebo but like very it was very open. I don't know if it but it was like a it was like a very solid structure not like a screened-in anything or anything.	
1	I pergola says sort of I don't know.	
3	It's the Greenbrier has one with like the little spring and like the oh a gazebo. Whoa, is it a gazebo is? Yes a gazebo? Okay, we'll say a gazebo. Yeah, and there was just like this creepy statue under it and all this stuff and then and it's called historic Jordan Springs. Okay. I don't know. I'm sure someone's heard of it. And it's this big L-shaped like three or four story mansion. Beautiful and beautiful house very very historic looking it's called historic Jordan Springs. So we roll up and we go inside and just immediately all of us get this weird feeling just like like we all felt it there were about four of us total that arrived at the same time. We're like man it this is kind of weird. It's just a heavy feeling and they're like, okay so the man cave where all the groomsmen will be getting ready and you can you can all put your stuff down there. For now all we do the rehearsal as well. It's downstairs in the basement. So we walk down in the basement and it just keeps getting worse. The inside of the house is beautiful. It was it was really beautiful and and the man cave was really it has like a nice big pool table and like autographed guitars on the wall and a bar and like little girl stuff very nice. And then I was like, okay. Well, I'm gonna check out I'm gonna keep going down this hallway and you're like in a dungeon basically, but the chapel the end or Chapel was in the basement because on the side of the house the house is sort of built into a hill. So even though you're in the basement, once you get to the chapel, there's a door that goes outside. So it's not totally it makes sense. Like it's not bad but we did the rehearsal and everything. I just took the longest way to get to this though, but I went to the event coordinator after the rehearsal and I was like, hey man, you know is this place is this place haunted at all? I was like, you know, I know you work here and you're here every way do you ever experience things and its name is cult cult Colt and he goes well, you know a lot of us here, we're kind of skeptical of it were Skeptics most of the things that we hear can be pretty easily debunked, you know, an old house creaks different, you know, heating and cooling systems and stuff and a lot of it a lot of a lot of things echo through the house. So we'll hear voices but it's someone you know may be on the other side of the house and the vent system and he had all these explanations. He was like, but truthfully I've never really had that much happen here that has scared me asked him when the house was built. All states back to the 1600s. Hmm.	
1	So I was like, okay stories not matching up now cold because I know this place has got to be haunted with that much time 1600.	
3	So and then before that it was a Native American they had like a little village there because it was the Springs Sulphur Springs and they they thought they were healing powers and all this stuff. And then the white man came and did what they did like always and we're like, hey, this is ours now. I don't buy cult story. I think Colts trying to sell us.	
1	Listen. This is where	
3	it gets good. So we go to the rehearsal dinner and we're all kind of talking about it, right? So I look up online historic, Jordan Springs. The first result I saw was Discovery Channel when ghosts attack historic Jordan Springs, Virginia, and I was like this man coat called strike old. All right, so I click on another video of like a history of a paranormal investigation, right? And who do I see front and center in the video given an interview another than cult again, here's called talking about all the stuff that's happened to him in this house and how everybody's had an experience and I'm like, all right.	
2	All right.	
3	All right Cole. I'm on to you now because you sat there and you told me and you just you said that this wasn't a haunted place and I get on Al Gore's internet and I see you front and center telling me that this place is haunted. So there's two conflicting stories. And so I get there the next day and I got there a little early because I was the photographer and I was going to get set up and get everything ready. So I'm I'm thinking you know, I bet everybody's down in the chapel and they're getting everything ready. So I walk downstairs into the basement check the man cave. Nope lights are turned off. Nobody's there getting a little nervous. I'm in the basement by myself at this point. I go down this hallway take a right you go down and I'll show you the picture real quick of what it looks like I go down this hallway. I look down the other hallway to the chapel doors are closed lights are off all of a sudden the light goes off where I am. So I'm in this basement terrified. It's dark it's dark.	
1	Oh, no cellphone service at all in the basement or just in general in the whole area the house itself.	
3	You get outside the house full, you know full bars in like one spot and then let you take three steps no service. So this is what I see. Okay lights go out that's in the basement of the house. Okay, very old as you can see ya this.	
1	Yeah, it looks like something you would find in. Oh, what's that game Amnesia Dark Descent.	
3	That's what I there was also a rope right here roping this section off in the chapel was over this way, and then all the lights just turned off. So I have like 30 pounds of camera equipment on me. Hmm sprinting through the house back up the steps, so It was pretty terrifying. I won't lie to you. It was actually very very terrifying experience. But it's funny some of the wedding pictures. There are orbs all over the place in these picture got them orbs, man. Oh, I don't know. I'm still going through the photos, but there are maybe they could sell that venue differently. Have you thought about the well, they that's what's funny is there's like there's like a like a Secret website for them. That's still official by them, but it's like a secret called. Haunted historic Jordan Springs. There's historic Jordan Springs at Compton. There's one it's like haunted historic towards right and it's and they sure were talked about the Paranormal investigations.	
1	Yeah, if you want like a pair because like people like having like the theme weddings and paranormal wet and it was I mean, it was a beautiful place for a wedding. It would be gorgeous figure lister's are in the northern Virginia area. I will check it out. They want one of our pieces of mails from a guy from Northern Virginia. I'm sure he's probably heard of it.	
3	It's probably have but if they do tours, it's a Like I said, I recommend checking it out, especially if you're into creepy things because it's beautiful. There's a lot of history there. A lot of presidents have stayed there. A lot of different generals had stayed there during the during the Civil War and all this other stuff was it was a hospital? I think at one point in the hotel at once.	
1	Yeah and and Cults over here going.	
3	Oh nothing's ever happened. I say we can explain everything. It was the same feeling I had when I told you the story about my dad's house at one time. It was that	
1	but worse, I'm just feeling like something's around you and yeah, I felt that way in there's a church out in with full Virginia that's like called like the church in the hill or the cave on the hill or something or that but it's like this old church and it functioned like it functioned as a civil war hospital and you can open up a closet and there's still blood stains from the Civil War if they cause what we're hospital if	
3	Nothing is said to have previously been anything actually just in general related to the Center for civil war. Right? I 100% will guarantee at on it. Yes. No, like no doubt like it.	
1	Yeah, there's no way not to be it's like upon this. It's like it's up on this hill it's in this Alcove. It's nasty business. Well this weekend I went and followed your recommendation and went to the Huntington art museum you did. I did Android I found it. Very delightful. It's like it's hidden away up there.	
3	Yeah told you you'll feel like you're just going to know where you have to drive through roads.	
1	I'm very familiar with but for Huntington that's pretty pretty settled. You're going like way our way up there but it's it's in a I guess a square with a little like open area in it and saw a lot of great art. It was really nice to had like Highschool exhibit a middle school exhibit. That was that Let's play obviously like more famous stuff. They had this really interesting like woven artwork that was there and a I guess it was an art display but it was historic guns. So black-powder rifle black-powder rifles. So you go. Yeah and a hand Cannon, which I thought was interesting which is literally Knights would take this thing. Thing that looked like a it looks like a small cannon that had been strapped to this piece of wood that the trigger was on top. So it was like more like a stick. Yeah with the cannon piece and they would fill it with like gunpowder I guess which is what you would I guess. I don't know much about how cannons work. Yeah meilin. Tell me what's wrong. It's Gotta Be It's gotta be some expired out there somewhere somewhere but nights would get on the back of the horse and they would have it. They just have one. Not during battle and they would fire their hand Cannon knows like that's what we need to call it.	
3	Something six this the it's like how you would get like one Grenade on Modern Warfare online.	
1	It's like hey would get there one that you there one shot at the beginning of the battle. So I went to I went there I try to go to the bowling alley over there and bowling alley not open Colonial Lanes not open that were was colonial. It was something out near that and and this is a hot take out near that terrible donut shop. Op called the Jolly dude.	
3	If you don't even talk trash about Jolly pirate, that's Jolly pirate is amazing.	
1	I know it's a hot take mmm.	
3	Also, you tried to go to Strike Zone the strike zone. Yeah that that place is the other bowling alley that's on Route 60.	
1	Yeah, we tried to go there is closed Jolly Jolly pirate or whatever is why would you serve now hear me out listeners will agree. Would you trust a donut shop that serves donuts and Euros? You don't know why they sell euros. How do they sell their own by a Greek family? Well, that's fine. I got then tick Greek that what I'm gonna go start a taco shop and I'm going to serve fish and chips too.	
3	They are you going to trust both of those things that that's the only Jolly pirate that does it the Jolly pirate in Ashland. Kentucky does not sell Euros. They just sell Donuts. I would trust that Jolly pirate more the both are owned by the same family.	
1	Well, I've had Donuts from the Jolly pirate and I thought that's fine. I could get better. Listen hot take get better ones at Krispy Kreme. Oh you shut. Your mouth. Yeah, I can get better ones.	
3	Oh, that's you're reaching like blasphemy levels right now.	
1	Have you read Carol?	
3	Even to Blacksburg a few times? I've never have you need to go. I bet it's trash. Yeah, I see how it feels when somebody bashes things you love.	
1	Well, you haven't tried it. So you don't know I however have tried it because I'm a worldly man a man of many travels, but I did eat at a fantastic restaurant to get on a more positive note called bahnhof Bonhoeffer, which I had never been to. Which is it was described to me as a German restaurant and I was like, okay, it's German Fusion food though. And I had this thing called it's so it's like you get sausages you can get schnitzel you can get nettle you can get all kinds of different German flavors, but they're all mixed with other types of food. So I had a currywurst which was a sausage made out to taste like Indian based Curry that It had like pistachios on top with dates and it was delicious.	
3	I think last time I was there I had a gyro but it was with sausage and it was pretty good.	
1	And then Selena got it was a schnitzel but it wasn't it was like a specifically Appalachians schnitzel.	
3	It was tasty and it be tasty.	
1	Yeah, it was it was real tasty. So if you're like that restaurant is one of the few places that is right now my favorite Shot I've eaten it there twice.	
3	I've been there one time it's so funny because you know, I spend a lot of time in Huntington, but I just never go there. It's a little pricey but it's really good.	
1	Well when you're Mushi mofo like me.	
3	Yeah.	
1	I say it's pricey and I'm sitting here drinking a little lady brought to look released to my house dog down cross lacrosse. And here we live down here in the city.	
3	Very comfortably gonna got my passion fruit Lacroix right? Hasn't it's my A restaurant. So right now I'm just want to just wanted to give them give them a quick shout-out for interesting interesting food in Appalachia.	
1	So if I ever go if you go to Camden parked only food Camden park and why did you do that?	
3	Why did you why did you go there in the first place?	
1	If you didn't have any kids probably just take a picture and be like I was there because once you get there, it's like a I don't know II can't talk hard. I can't talk hard can't part. Yeah can't talk about it. But with that, we've got a new inside the vault. Get into here we go into fought so many sex for those people. We had West Virginia food. We had borderline West Virginia go stores and now we're going to have some Western video game. How do you feel about that? Sounds good. So I'm just going to read it.	
3	I forgot they can't see me dude.	
1	No, they can't see you do your dance move? Whoa, you should see I saw him once break dance while talking to me and I was amazed at the sheer talent that this youngster has I've been truly amazed. Sometimes you just gotta do what you gotta do you gotta perform. So I'm just going to read read this off because I actually thought that the narrative was Interesting rather than trying to summarize it. I'm not going to read the full thing. But I'm going to read the stuff about ever upwards.	
3	Let's do it.	
1	So this is in regards to the new patch or I guess part of wild Appalachia season in a quest called ever upwards or a series of quest. So the Intrepid Pioneers Scouts have a long history of inspiring the children of Appalachia to strive ever upwards ever upwards put a trademark on the on Missions of self-improvement and the betterment of their communities however lack of interested children in the wake of the Great War has caused active Scout numbers to dwindle hoo hoo. Ha ha the Pioneer Scouts are taking their philosophy of inclusivity to a whole new level by accepting recruits of all ages as a novice tadpole. You will need to prove you've embraced the Pioneer Scout Lifestyle by completing activities to demonstrate their core values kindness. Hopefulness bravery and growth you can also earn badges that show your Mastery over traditional activities like swimming archery cooking Athletics and More in addition to measuring individual growth badges will come in handy at the Pioneer Scout vending machines trade your badges in four themed loot that you can use to enhance your camp and show off your pioneering Spirit. Once you've been promoted to the rank of Mighty possum. I enjoy highly you will be able to pursue tougher badges that will reward you with your first backpack listening in this is about a an event that happens and I'll talk more about that. But listening to spooky stories around the glow of a campfire as a time-honored Pioneer Scout tradition had to Camp Adams after Nightfall to hear about the Terrors of the dark. Listen closely But be sure to look over your shoulder for any real creepy. Here's that may be lurking in the shadows. Don't worry too much. The story was originally told to more age-appropriate tadpoles and possums so will be too scary for our most veteran most veteran of the wasteland about to get Boy Scouts and Girl Scouts up in here.	
3	Yeah. Well and I like very well with the theme of what's going on in West Virginia this year. That's true. We do have this year now the world Boy Scout Jamboree	
1	Well such as this year, it's every year. We have the world that we don't just this year.	
3	We have Scout Jamboree, which is like a national thing but the world jamborees here this year. So we have people from all over the world coming.	
1	Oh, you're right. We can't because it's big it's a big deal every other year.	
3	But this year it's like a big deal.	
1	There's some insight is some insight at work have been preparing. Do you guys have to deal with this to we I can't I can't talk about what we have to do. We have to do things you guys are so for this we are associated.	
3	Well, it's cool though. It's going to be cool. I think there's going to be roughly 50,000 people there. Yes, which will make it like at that point like the biggest city in West Virginia for like a solid what two or three weeks. I think it explains but it'll be cool. So that's it's kind of neat that they're doing the Boy Scout thing and we've got this Big Boy Scout event and it's a big deal. Oh, yeah, definitely.	
