speaker_tag	text	sentiment_score
1	It's like a great cool. Do you good for you? Good you think about what you need to do to do that, you know because I saw a lot of I've seen a lot of guys like leave spinning and they like go this like other route and their careers like tank and I always you come back. It was just always come back and I don't even think it's because you can't go independent and be successful. It's because I don't think they understand like The label was doing all these things that you don't even know they were doing and you were complaining the whole time. But now you're on your own and none of those things are getting done in your seeing the reality of like oh shit. Like I need to shoot my own video. I need to hit up Kramer. I need to get a YouTube channel all these things.	
2	That's why I like, you know saving, you know when you guys get your label, you know, it's like having someone running being like, you know, managing managing the label that that's like your eyes and ears. Yeah. You know for you know that thing they're going to be the ones really, I mean you as obviously bring in like artists and stuff but like in terms of all like the NIT grit stuff like the dealing with the we talk about all the time.	
1	I push it that we're going to do metadata. You know, I'm not gonna be sitting on a computer like I love the meta dad.	
2	I was like that's not gonna happen going back and forth on like legal threads that take for freaking ever like, you know, that's that's your, you know, every label is going to need like, you know, and needs, you know eyes and ears labeled. Yeah. Exactly. And that's the layer manager. Is it Sighs and you Of see if whether it's the CEO CFO of the company or its the label is like an artist run label, you know, that's and I'm getting Doug on. Yeah, the dog is going bad side buddy speaking about dsps.	
1	One thing. I thought is interesting and you manage predominately base guys.	
2	That's just yeah, that's just what kind of what's kind of, you know been you know lucrative on the tour front.	
1	I obviously I started I was he it's such a crazy business thing because we come from like house world and pop world and stuff like this where I come from. Yeah. Our artist that's where we are we live but the one thing that's so crazy to me is that base artists on dsps? Not really killing it like even excision 400,000 monkey lizard. Yeah, but they sell so many tickets and it's such a weird connection, right? Like what do you think that is like why? Why do you feel like a excision track highest track? He has is probably five million streams, but he can sell 20,000 tickets.	
2	What is the break it down for us? We all come from this world. It's the difference between Like the the emo pop in the metal. Yeah, it's the same thing. You know, it's like the guys who are wearing. Emo and we're crossing over in that whole Rock thing in the early 2000s. They were you know, obviously selling a lot of tickets but also like killing it in sales, right? Whereas like, you know, the metal guys, the the quota for sales was we're a little less on records, but they were selling crazy ticket. Yeah, and the dubstep fans are just like metal fans. It's so weird. This is no loyalty is like there.	
1	There's a weird CD store where these dubstep kids are going. And buying the CDs because it's like where are you listening to the music?	
2	You just gotta think like emo bubbles kind of similar to the dance bubbles that I wasn't seeing in the way, it's these I feel like it's just so much more loyal like don't metal though those 400,000 streams that excision has on a song every one of those streams is from one kid. That's going to go to one of his show your I mean rather than you can have a song that has 50 million streams people can't bring a hundred people to a show and not just buy tickets to the show by buy all their merch, you know, so it's like fan for life. Like that's the hundred fan thing like,	
1	The equity decision to sold 20,000 bucking tickets at NAS events center and I think literally has highest song has 5 million streams may be 10 10 million, which it's a hundred fan thing.	
2	It's like, you know, what would you rather have like a million Facebook followers or would you rather have like like a hundred people that will buy a ticket to every one of your shows and by every piece of your merge. Yeah, you know, it's true.	
1	Yeah. It really is like that loyal DieHard fucking, you know fan base. Obviously if you guys got a crazy vocal for a Company, like I feel like you'd probably like swing for it. You know, if you have like a hit Uncle you thought was a hit you probably like. All right. Yeah, we're gonna give this a fucking shot.	
2	Well, yeah and you know, and that's what's cool too is, you know, he's able to invest now because he's been you know working really hard touring. He's good with his money.	
1	Are you are you helping these guys like with Finance finances are you like I do they all have business managers. Are you kind of like stepping in like, hey like take it from me save money for saving money right now taxes.	
2	You're right now. It's about just In the bottom line and you know, I mean obviously, you know, they're doing they're doing pretty well, but they don't have business managers just yet. Yeah, but we're going to get there. We want to find the right people dude.	
1	Honestly, we got rid of business managers Dave just took over and it's been such a smoother ride like just for you. No advice to any kid who wants a business manager. Yeah. My dog is about to kill Asante. It's not even a necessary what's in there? It's my keys. Oh my dogs trying to To eat his keys right now. Whoo. Okay. Yeah for advice for artists that wants a business manager. It's like it's not an it's not a necessary evil. So to speak, you know what I mean? Like you can get by without it and save yourself that 5% You just have to be on top of you just have to be on top of it and like understand it like there's gonna be taxes.	
2	There's going to be this and that and this and that and it's like it's just different in its own people or you know, no matter how much money they make they're still sweating bills, you know, everyone's different with their money. Yeah, that's where in so it's like yeah, I mean, it's really Case by case when it comes to recommending business managers at any at any level, you know, so you're from you're from La.	
1	Yeah born and we were we were pretty much grew up like right next to each other. Yes, I grew up in Studio City like which is like kind of the Piedmont bottom of the Hollywood Hills what got you like into the music business like what like like when I met you, I know that you like come from like a guitar background like fucking shredding. Yeah are like you were like us who grew up like a metal fuck. Like yeah, how do you go from you start like bands?	
2	I'm assuming probably like when you're younger I got actually got into producing because you know, I know I know music theory and all that stuff. So I would be the ID that one band member when I be starting bands. I'd write the music for everyone and I got so heavily into like the you know, the like metalcore like shredding stuff. Like I don't know II trouble like keeping people around or having people I could keep up with like the crazy shit that I was like writing. So I took to write it all in this thing called tab it was This like I remember that you could like enter you could like enter like guitar tabs.	
1	Yeah to have it into like a software that weird like the kind of a guitar noise to that.	
2	It sounded like a like a yeah, like a monophonic like like Nokia of ringtone, but I didn't realize until college that what what I was doing was was dot was dot work. I was producing music. I was writing full songs and midi. Yeah, and I didn't even realize it and then I got Ableton and I was like, oh, this is like the same shit just way more complex sounds of always midi. I just yeah, so I mean, so in terms of sequencing I always had like a leg up but then it took me, you know, obviously just like everyone Forever learn how to like process everything and all that stuff. And yeah, I thought I fell in love with it. And that was kind of where it began, you know?	
1	Yeah, like your metal kid you you start fucking around like Ableton essentially then you just fall in love with like dance music and your your group charity strike was like it was like big room house pretty much like at that at the core of it was pretty much bigger than yeah.	
2	We are one of those axelle like we kind of you know, we won some like be poor remix contest doing base kind of like some dubstep stuff and then we A jumped into like doing house stuff like that kind of the big room thing when that was like happening and got some traction and then sort of you know, right it was that was really at the tail end when like artists were touring big awful like a big remix or something. Yeah. It was the golden fucking are a man.	
1	We're all you have to do is make a big remix. I was just like man stage Ultraman.	
2	We just flip this fucking karelis on what exactly and and you know, it was it was cool. He had a good like you, you know year-round like, you know being for people and If way we're getting the right looks shout out, you know Andrew who's now became his manager. He was our agent. Yeah. Yeah, he killed it for us. But you know sometimes you know, if a project isn't working it gets hard. Yeah, and you know, I always saw the side of it, you know, like, you know, the our manager and agent of the time like I understood, you know, and then I just I just I just had an epiphany and then started I want to work towards You know building actual industry experience and learning the back end, right?	
1	Yeah what you were I mean you while you were in the project you were working at Dimock records to uh, yeah and your tour managing right as all the same time. I was out a little bit after Mike is Mike is an all-around Hustler pretty much about Mike is this story is very interesting you like went from like being in a metal band starting like a big room house Duo working at Dimock tour managing board just like you've done is a renaissance man of EDM. Mike might be fucking personal training people right now to I think I like I guess a business Mogul.	
2	Yeah, whatever whatever whatever got to do is survive. Yeah.	
1	Yeah, you're just one of those guys. You've always been one of those guys were like this to like you like making yourself busy. You know what I mean? Like, you're the kind of guy that will create jobs for yourself because you hate not doing shit.	
2	Well, yeah, and I'm always one that wants to grow and I'm very realistic. You know, I'm not going to ever really feel comfortable say like, you know financially or whatever like I'm always going to be like grinding We're never going to you know be content with where I'm at. And I'm never too. I'll never really be to like say like to I don't know in a sense like too big for a job or somebody. I'm always grind it out. Yeah, like a bowl to hustle exactly. I'm always going to want to be there to help people out and be a beyond the net grid of things, you know, and and you're one of those guys you go a hundred and ten, you know what I mean?	
1	Like well, yeah you see you like you're like, all right. I'm gonna eat good. I'm gonna meal prep seven days a week. I'm going to man. I'm going to manage all these motherfuckers. I'm gonna I'm gonna produce I'm gonna produce all the way you like work to Dimock you were doing like 13 jobs that you don't even need to do. You're just one of those dudes which I like go after lot and babe goes after lot. Like you're one of those guys, you're not half-assing shit. You're gonna go a hundred and ten all the time. Yeah. It's something that we like we get the end all time and kids like what do you what's your suggestion to like making it this and that I'm like dude this industry the music industry in general like being the most talented. It's one thing. I mean, obviously if you're Zed and you're like, Literally the most talented person in the room. Okay, but for the most part, it's can you out grind the next guy? Well, yeah realistic, you know what I mean?	
2	It's all survival. Dude. We're all like entrepreneurs partnering up with other entrepreneurs, you know, like some of these entrepreneurs are like, you know have a chair out an office but it's you know, we're all just that's why it's so wild west in the music initiative, you know Wild West everyone kind of owns their own operation.	
1	No, we're just a bunch of degenerates. I mean realistically We like all of us were just band kids or DJ kids or whatever. None of us are like none of us are like School smart, like pretty much we're all pretty like weirded. We're guys that couldn't get our brains to work like everybody else. So we started our own fucking planet called the music industry. I mean like I talked about all the time. People are like, yeah, this A&R said this or that I'm like, okay most likely this A&R was a failed musician. So he was like, I didn't make it as a musician. So now I'm going to be an r and then now they're like the biggest and around the world. Let's say but it's like he's still a degenerate man. Like it's still a guy who didn't want to get a real job. So he works at a label. I mean that's that's the real, you know, like the president of democra Kurds. It's like he just didn't want to go work at fucking Microsoft or like wherever our be a lawyer like everybody else, you know, so it's it is the Wild West it's funny that you said that's that's a good way to put it true.	
2	Yeah, man, they all yeah that really any rules. You just kind of like the only rules like just be like nice and respect everybody. And other than that, it's like you don't have to be anywhere any I mean if you don't want to go to a show, you don't have to go if you don't want to go to the office, like I feel like you don't have to go. Yeah.	
1	Listen, I've never worked in a music business office, but I feel like people had in. My probably just weren't coming today. I feel like you go there like drunk even you don't even like you show up to your work. Hey, we met with them. It seemed like people in there were drunk.	
2	Yeah. No, I mean they run they run a clean operation, you know, but you know, they they have I mean, there are people working under them the rules and all that sort of clear that up they do actually	
1	In operating buddy democracy strong you are do you still chat with those guys that I is it even the same people there anymore?	
2	Boom finale all the time.	
1	I still see Lauren who is like exploring all everywhere because he's really close with Austin. So every time we're around or isn't funny guy.	
2	Yeah, it's great. I mean he was one of the first people to really believe in like me is like an individual like and on a music industry standpoint, you know, yeah.	
1	So you also do you like run a lot of people's like broadcast shows to write or I don't know if you do that anymore. I Do you like your first leg into like the industry?	
2	I kept me alive doing you know doing the you know, helping with the SiriusXM shows engineering track listing, whatever.	
1	Yeah, I helped you a lot on the A and our perspective of knowing what was a good record because you were just getting so many records over sure.	
2	I mean that was also a way that I would discover artist who I mean that was how I discovered like is in the beginning a promo for somebody like kind of an improvement. Well, who is this good? Yes, I mean that's always been cool having like my finger on the pulse of that sort of stuff. But you know, I never when it came to like radio production stuff. I didn't have once again like the passion to like create my own like noise house. I probably could have one point where like go work at Sirius XM is like a program. It wasn't like your passion could have created like a business that competes with these Titans, but I just, you know, I wanted to get in the manufacturing side.	
1	Yeah, you know, it was a means to an end. It was like a it was a it was a you paid rent from it. It wasn't like your main priority.	
2	Yeah becoming a line for sure.	
1	How did you like? How did you liked or because you tore managed?	
2	Sorry. I'm talking to your doctor. Stop it.	
1	He's biting on Mikey you tore managed Borgeous and like karela for a second, right? Yeah. So like, how did you how did you find the tour management side compared to like the management side, really really really different.	
2	Yeah. I mean it really just depends on the shared the share. Duties per se because when I was when I was doing borders, I was doing his day-to-day management to so is like a combined gig. Whereas like Cruella when I was, you know, helping them out on the road. I was basically just filling in for like a few months was cool. I love the girls, but you know, they had they had their day two days and basically at base, you know, Mission Control, you know, I'd go to the day-to-day is for everything, you know, so yeah.	
1	Yeah, so it's a different just a different lifestyle pretty much different types of formatting.	
2	Yeah. I mean, it's basically, you know, you're the artist. Road. Yeah, and then that's cool. You know, I I think it's a great rewarding gig and I recommend anybody that really wants to like learn the back end of the industry and touring to get into it. Yeah.	
1	Yeah, I learned I really wanted to have you on here is because a lot of kids don't know how to get from A to B. And it's like your story really is like a to be story. It's like it's like local band kid to touring DJ. Yeah to the label side of things to tour manager to full-time manager. It's like you really went up the fucking Mountain like	
2	You no way no, I didn't I didn't come from you know, I mean, my mom is a big TV writer, you know, but like I you know the film it's not as like entrepreneurial, you know, you work for the studio, so I didn't come from like a really entrepreneurial family, right? And so I had to figure all this shit out like on my own and so it just it took a little longer, but I'm finally kind of rolling with the you know, the freedom per se and I really like it.	
1	Yeah. Well, I mean, I guess for to wrap it up like a kid writes you Wants to be a manager. You're like, alright, you don't know anything about it. What's like your go? All right. This is how you start like, let's let's get the fucking ball rolling.	
2	So you say something like that like a kid?	
1	Yeah that comes to you. Like I want to be a man's First Step. What was the first act like, how do you how do you get going?	
2	I would try to work. I would try to get like an it's like a young kid or like a student. I would try to get like an internship or you know, like like a gig working at one of these these companies say like a red light or a UTA I mean or label even you know, you'll either one you'll learn about the label side. You'll learn about the manufacturing site or learn about the booking side. And then from there really get good at one of those and then from there if you will save going to be manager use that one Edge you have and then learn them the best you go as you go. Yeah, but yeah, but you got one really one really strong strength. I can help an artist in the beginning. Yeah.	
1	Well, thank you for stopping by Le Santi Mike.	
2	Did you already work out I did.	
1	But I got I got a gym man. I got no, I think I woke up a little late and I didn't get to go so I'm gonna go after this. Hell, yeah. Thanks for stopping by bro. Thanks for having me out. We're all I got Dave does a rock signs to the microwave. Peace, bitch.	
